{
  "schema_version": "0.1",
  "artifact_id": "art_2026-04-14_branch_root_2026_04_14_main_summary",
  "artifact_type": "daily_summary",
  "snapshot_id": "snap_2026-04-14_branch_root_2026_04_14_main",
  "root_id": "root_2026_04_14",
  "branch_id": "branch_root_2026_04_14_main",
  "package_ref": {
    "package_id": "yysworld-package-v0.1",
    "package_created_at": "2026-04-14T00:10:00Z",
    "package_hash": "sha256:26ba0b28ca3051eb06a5f09101a037d195cab275f660774908456b69d7ef698f"
  },
  "model_refs": [
    {
      "provider": "anthropic",
      "model_id": "claude-sonnet-4-6",
      "model_version": "2026-04-14",
      "role": "summarizer",
      "runtime_class": "cloud",
      "parameters": {
        "temperature": 0.2,
        "top_p": 0.95,
        "max_tokens": 4000,
        "seed": null
      }
    }
  ],
  "comparison_contract_version": "0.1",
  "content": {
    "title": "YY woke up wrong",
    "tone": "mildly_sour_but_moving",
    "narrative": "YY woke up wrong.\n\nNot sick-wrong. Not danger-wrong. Just — the light was already doing something it shouldn't be doing yet, and the sounds outside were all in the wrong place for morning.\n\nIt took a moment to land.\n\nAcorns.\n\n\"Oh MAN.\"\n\nNobody heard this. It was said anyway.\n\nYY lay there for another few seconds, not because there was anything to figure out, but because the situation deserved at least that much acknowledgment. Then got up. The hunger was already there, patient and unhelpful, settling in like it planned to stay.\n\nThe day started. The acorns did not.",
    "state_note": "Attention running low. Not from anything big — just from the particular flatness of a morning that started without acorns. The kind of mood that doesn't stop you from doing things. It just makes everything slightly less interesting than it could have been.",
    "summary": "Missed the morning cache. Felt it. Said so. Moved on — but not cleanly.",
    "state_delta": {
      "food": "0.7 → 0.45",
      "attention": "0.65 → 0.50",
      "burden_carried": "missed_breakfast",
      "branch_created": false
    }
  },
  "created_at": "2026-04-14T23:00:00Z"
}
